sku,name,type,size,price,in_stock,description
WB-001,Terracotta Sunset,wooden,2.6,450,yes,"Hand-finished sheesham wood in a warm terracotta tone. Lightweight and smooth, with a natural grain that makes each piece subtly unique."
WB-003,Walnut Dusk,wooden,2.4,450,yes,"Deep walnut-stained wooden bangle with a matte finish. Pairs beautifully with both Indian and western looks."
RB-002,Teal Tide Resin,resin,2.6,550,yes,"Translucent teal resin with a hint of shimmer. Catches light differently from every angle."
RB-005,Amber Drop Resin,resin,2.8,550,no,"Warm amber resin with suspended gold flecks. A statement piece for festive wear."
BB-001,Antique Brass,brass,2.6,650,yes,"Solid antique-finish brass bangle. Sold only as part of curated stacks."
